1311084019946201000,1311084019946201088,2020-09-30 06:22:43 SE Asia Standard Time,2020-09-30,06:22:43,+0700,1086650434251411500,richietan13,Richie Tan,,DR. TIRTA : VAKSIN BUKAN OBAT part  #psbb #covid19 #corona #jakarta #pemerintah #psbbnewnormal #psbbtotal #sanksisosial #psbbtransisi #pelanggarpsbb #masker #hatihati #pelanggarpsbb #tidakpakaimasker #bersihkankali #aturanpsbbterbaru #sanksipsbb  https://t.co/qn1mGBCTKO,in,https://youtu.be/wVSe9nPxS6A,0,0,0,https://twitter.com/RichieTan13/status/1311084019946201088,false,,0,,,,,,,,,,,,,,,psbb,covid19,corona,jakarta,pemerintah,psbbnewnormal,psbbtotal,sanksisosial,psbbtransisi,pelanggarpsbb,masker,hatihati,,,,,,,,,,,,,,,,,,,,,,,,,pelanggarpsbb,tidakpakaimasker,bersihkankali,aturanpsbbterbaru,sanksipsbb,,,,,,,
1311024981682172000,1310917652118867968,2020-09-30 02:28:07 SE Asia Standard Time,2020-09-30,02:28:07,+0700,992745774957056000,sudahminumteh,Aku 🤓,,"@drpriono1 @aniesbaswedan @jokowi Maju terus pantang mundur @aniesbaswedan, walau psbb 2.0 ini kurang tegas, mirip2 psbb transisi aja...",in,,0,0,0,https://twitter.com/sudahminumteh/status/1311024981682171904,false,,0,,,,,,,,,,,,drpriono1,Juru Wabah 🇮🇩,1297362611026059269,,,,,,,,,,,,,aniesbaswedan,anies baswedan | sudah #vaksindulu,110312278,,,,aniesbaswedan,Anies Baswedan | Sudah #VaksinDulu,110312278,jokowi,Joko Widodo,366987179,,,,,,,,,,,,,,,,,,,,,,,,
1311022425329393700,1311022425329393665,2020-09-30 02:17:58 SE Asia Standard Time,2020-09-30,02:17:58,+0700,91992435,prastowo_o,Prastowo Widiantoro,,"Bodo amat sama pencarian menkes. Gue lebih kepo alias kangen lihat and nimbrung sama orang yg hidup normal, at least kayak masa transisi kemarin deh. Daripada PSBB lagi, udah edukasinya mentok disitu-situ aja, ya pantes situasinya nggak jelas terus. 🤯🤯🤯",in,,1,0,0,https://twitter.com/prastowo_O/status/1311022425329393665,false,,0,,,,,,,,,,,,,,,,,,,,,,,,,,,,,,,,,,,,,,,,,,,,,,,,,,,,,,,,,,,,,,
1310957126286704600,1310957126286704640,2020-09-29 21:58:29 SE Asia Standard Time,2020-09-29,21:58:29,+0700,2917064060,lenterakris,LenteraKristiani.com,,Pergub Baru Anies: Motor Pribadi Kena Ganjil Genap Saat PSBB Transisi  https://t.co/lK5AKbgE5D,in,https://ahbnews.com/pergub-baru-anies-motor-pribadi-kena-ganjil-genap-saat-psbb-transisi/?utm_source=ReviveOldPost&utm_medium=social&utm_campaign=ReviveOldPost,0,0,0,https://twitter.com/LenteraKris/status/1310957126286704640,false,,0,,,,,,,,,,,,,,,,,,,,,,,,,,,,,,,,,,,,,,,,,,,,,,,,,,,,,,,,,,,,,,
1310942236398542800,1310942236398542857,2020-09-29 20:59:19 SE Asia Standard Time,2020-09-29,20:59:19,+0700,238030759,reez_aa,Z,,"Profit perusahan udah mulai naik stlah psbb transisi, sekarang anjlok lagi",in,,0,0,0,https://twitter.com/Reez_aa/status/1310942236398542857,false,,0,,,,,,,,,,,,,,,,,,,,,,,,,,,,,,,,,,,,,,,,,,,,,,,,,,,,,,,,,,,,,,
1310920369662914600,1310513176048357377,2020-09-29 19:32:26 SE Asia Standard Time,2020-09-29,19:32:26,+0700,1232502469193633800,pembela_kbnran,khanayola,,"@podoradong Udah lama kali pembahasan Ciptaker di hotel, dari jaman sblm PSBB transisi juga udh bahas di hotel, udah 4 atau 5 bulanan dari hotel ke hotel",in,,0,0,0,https://twitter.com/pembela_kbnran/status/1310920369662914560,false,,0,,,,,,,,,,,,podoradong,Podoradong,1241349546627567616,,,,,,,,,,,,,,,,,,,,,,,,,,,,,,,,,,,,,,,,,,,,,,,,
1310920349136179200,1310917652118867968,2020-09-29 19:32:21 SE Asia Standard Time,2020-09-29,19:32:21,+0700,234586131,alfamaulana01,Alfa Maulana,,"@drpriono1 @aniesbaswedan Maaf dok, sy pikir psbb saat ini di dki tdk byk berbeda dibanding ms transisi, kantor2 msh full tanpa tindakan, jalan2 msh ramai, byk perilaku tdk 3m.  Ini akan memperlama wabah. Apa tdk ada cara u lebih mempercepatnya...tlg bantu @aniesbaswedan. Klo kada yg lain sdh ga peduli.",in,,0,0,0,https://twitter.com/Alfamaulana01/status/1310920349136179200,false,,0,,,,,,,,,,,,drpriono1,Juru Wabah 🇮🇩,1297362611026059269,,,,,,,,,,,,,aniesbaswedan,anies baswedan | sudah #vaksindulu,110312278,,,,aniesbaswedan,Anies Baswedan | Sudah #VaksinDulu,110312278,,,,,,,,,,,,,,,,,,,,,,,,,,,
1310898746633248800,1310548334075998208,2020-09-29 18:06:31 SE Asia Standard Time,2020-09-29,18:06:31,+0700,1277636881698578400,pengelolakebon,yourfavgardener,,"@mierafebrina @hrdbacot Dari jaman awal corona katanya gk akan masuk indo, ampe rame dan jakarta psbb, trus psbb transisi dan psbb lgi tetep aja masuk. Ampe dikasih surat klo kantor dapet izin beroperasi &amp; surat keterangan pegawai",in,,0,0,0,https://twitter.com/pengelolakebon/status/1310898746633248768,false,,0,,,,,,,,,,,,mierafebrina,miratharayyanu 😎,60484180,,,,,,,,,,,,,,,,,,,hrdbacot,hrdbacot,501800437,,,,,,,,,,,,,,,,,,,,,,,,,,,
1310897374525403100,1310895960990515201,2020-09-29 18:01:04 SE Asia Standard Time,2020-09-29,18:01:04,+0700,1143688002473906200,putcehhh,Putri Indri N,,"@collegemenfess Semangat yaaaaa. Aku juga ngerasa bimbingan agak berat dan terhambat pas kemarin psbb total. KTA beneran baru bisa kekejar pas transisi. Kamu yang kuat, pasti bisa kok. Belajar yang rajin yaa, tugasnya jangan lupa. Pelan pelan! ❤️",in,,0,0,0,https://twitter.com/putcehhh/status/1310897374525403136,false,,0,,,,,,,,,,,,collegemenfess,COLLE | CEK PINNED,1046084008742801408,,,,,,,,,,,,,,,,,,,,,,,,,,,,,,,,,,,,,,,,,,,,,,,,
1310843982444785700,1310838749803081728,2020-09-29 14:28:54 SE Asia Standard Time,2020-09-29,14:28:54,+0700,445861954,adhawjy,backbonekeluarga,,@KompasTV Mana buktinya ?? Gak Ada bedanya Sama PSBB transisi kemaren ..,in,,0,0,0,https://twitter.com/adhawjy/status/1310843982444785664,false,,0,,,,,,,,,,,,KompasTV,KOMPAS TV,71436318,,,,,,,,,,,,,,,,,,,,,,,,,,,,,,,,,,,,,,,,,,,,,,,,
1310842372343976000,1310842372343975936,2020-09-29 14:22:30 SE Asia Standard Time,2020-09-29,14:22:30,+0700,1105020299752300500,_orasnews,OrasNews,,New post in Kabar OrasNow:  https://t.co/gPhEp8j3h2 45 Kendaraan Ditindak di Hari I PSBB Transisi Jilid VI   @OrasNews_Channel  https://t.co/RauMg5IIL2,in,http://MimbarRakyatNews.com,0,0,0,https://twitter.com/_OrasNews/status/1310842372343975936,false,,0,,,,,,,,,,,,,,,,,,,,,,,,,,,,,,,,,,,,,,,,,,,,,,,,,,,,,,,,https://ift.tt/3jcHXEn,,,,,,
1310818998469030000,1310818998469029889,2020-09-29 12:49:37 SE Asia Standard Time,2020-09-29,12:49:37,+0700,68930552,mediaindonesia,Media Indonesia,,"Para pengusaha restoran telah menaati protokol kesehatan sejak PSBB transisi. Lagipula, belum ada klaster restoran.   https://t.co/X3Wg58D5a9",in,https://mediaindonesia.com/read/detail/348668-phri-minta-anies-izinkan-warga-kembali-makan-di-restoran,0,0,2,https://twitter.com/mediaindonesia/status/1310818998469029889,false,,0,,,,,,,,,,,,,,,,,,,,,,,,,,,,,,,,,,,,,,,,,,,,,,,,,,,,,,,,,,,,,,
1310808204062924800,1310808204062924800,2020-09-29 12:06:44 SE Asia Standard Time,2020-09-29,12:06:44,+0700,1243199094,sbsinews,SBSINews.com,,"Riset: PSBB Transisi Bikin Kunjungan Mal Meningkat, Lampaui Supermarket  https://t.co/yCHfOSmysJ",in,https://sbsinews.com/riset-psbb-transisi-bikin-kunjungan-mal-meningkat-lampaui-supermarket/,0,0,0,https://twitter.com/sbsinews/status/1310808204062924800,false,,0,,,,,,,,,,,,,,,,,,,,,,,,,,,,,,,,,,,,,,,,,,,,,,,,,,,,,,,,,,,,,,
