id,conversation_id,created_at,date,time,timezone,user_id,username,name,place,tweet,language,urls/0,replies_count,retweets_count,likes_count,link,retweet,quote_url,video,thumbnail,near,geo,source,user_rt_id,user_rt,retweet_id,retweet_date,translate,trans_src,trans_dest,reply_to/0/screen_name,reply_to/0/name,reply_to/0/id,hashtags/0,hashtags/1,hashtags/2,hashtags/3,hashtags/4,hashtags/5,hashtags/6,hashtags/7,hashtags/8,hashtags/9,hashtags/10,hashtags/11,mentions/0/screen_name,mentions/0/name,mentions/0/id,mentions/1/screen_name,mentions/1/name,mentions/1/id,reply_to/1/screen_name,reply_to/1/name,reply_to/1/id,reply_to/2/screen_name,reply_to/2/name,reply_to/2/id,reply_to/3/screen_name,reply_to/3/name,reply_to/3/id,photos/0,photos/1,photos/2,reply_to/4/screen_name,reply_to/4/name,reply_to/4/id,reply_to/5/screen_name,reply_to/5/name,reply_to/5/id,hashtags/12,hashtags/13,hashtags/14,hashtags/15,hashtags/16,urls/1,mentions/2/screen_name,mentions/2/name,mentions/2/id,mentions/3/screen_name,mentions/3/name,mentions/3/id
1314697407049937000,1314697407049936898,2020-10-10 05:41:02 SE Asia Standard Time,2020-10-10,05:41:02,+0700,2917064060,lenterakris,LenteraKristiani.com,,Pergub Baru Anies: Motor Pribadi Kena Ganjil Genap Saat PSBB Transisi  https://t.co/lK5AKbgE5D,in,https://ahbnews.com/pergub-baru-anies-motor-pribadi-kena-ganjil-genap-saat-psbb-transisi/?utm_source=ReviveOldPost&utm_medium=social&utm_campaign=ReviveOldPost,0,0,0,https://twitter.com/LenteraKris/status/1314697407049936898,false,,0,,,,,,,,,,,,,,,,,,,,,,,,,,,,,,,,,,,,,,,,,,,,,,,,,,,,,,,,,,,,,,
1314535741112811500,1314535741112811523,2020-10-09 18:58:38 SE Asia Standard Time,2020-10-09,18:58:38,+0700,1183032408255287300,juyeonjaksel,‏jean,,"padahal transportasi umum fav gue bgt, sebelum covid bisa sampe tiap hari naik mrt terus, kmrnan pas psbb transisi aja klo mau ke kantor pasti slalu naik ini, sedih bisa ancur begini 😌",in,,0,0,0,https://twitter.com/juyeonjaksel/status/1314535741112811523,false,https://twitter.com/iyanners/status/1314361560278605824,0,,,,,,,,,,,,,,,,,,,,,,,,,,,,,,,,,,,,,,,,,,,,,,,,,,,,,,,,,,,,,,
1314498560096780300,1314490170964549632,2020-10-09 16:30:53 SE Asia Standard Time,2020-10-09,16:30:53,+0700,624211261,a_doni95,Aditia  Doni  S,,"@KompasTV Dari berita udh banyak sekali,  Para Politikus,birokrat tampak tenang2 aja.  Apakah Terkait kebijakan PSBB transisi atau hasil test positif corona,  Oknum TNI ngamuk dan menyerang  polsek Ciracas?",in,,0,0,0,https://twitter.com/a_doni95/status/1314498560096780290,false,,0,,,,,,,,,,,,KompasTV,KOMPAS TV,71436318,,,,,,,,,,,,,,,,,,,,,,,,,,,,,,,,,,,,,,,,,,,,,,,,
1314495068385038300,1314495068385038336,2020-10-09 16:17:01 SE Asia Standard Time,2020-10-09,16:17:01,+0700,2917064060,lenterakris,LenteraKristiani.com,,Pergub Baru Anies: Motor Pribadi Kena Ganjil Genap Saat PSBB Transisi  https://t.co/lK5AKbgE5D,in,https://ahbnews.com/pergub-baru-anies-motor-pribadi-kena-ganjil-genap-saat-psbb-transisi/?utm_source=ReviveOldPost&utm_medium=social&utm_campaign=ReviveOldPost,0,0,0,https://twitter.com/LenteraKris/status/1314495068385038336,false,,0,,,,,,,,,,,,,,,,,,,,,,,,,,,,,,,,,,,,,,,,,,,,,,,,,,,,,,,,,,,,,,
1314438933032300500,1314438926715637766,2020-10-09 12:33:57 SE Asia Standard Time,2020-10-09,12:33:57,+0700,966117497219948500,ornithogalumm,agul,,"psbb ini bakal berakhir bentar lagi. gatau mau diperpanjang, atau jadi psbb transisi lagi. yang jelas, gw bakal mencoba buat ga pergi ke tempat keramaian supaya bisa memutus rantai penyebaran.",in,,1,0,0,https://twitter.com/ornithogalumm/status/1314438933032300544,false,,0,,,,,,,,,,,,,,,,,,,,,,,,,,,,,,,,,,,,,,,,,,,,,,,,,,,,,,,,,,,,,,
1314395157144371200,1314393259540574209,2020-10-09 09:40:00 SE Asia Standard Time,2020-10-09,09:40:00,+0700,1037982819622871000,masand071,#sehatterus,,"@gerhardhulu jangan dong,,, udah hancur lebur nih,, masuk ke psbb transisi lg saja gpp deh",in,,0,0,0,https://twitter.com/Masand071/status/1314395157144371200,false,,0,,,,,,,,,,,,gerhardhulu,G,119026143,,,,,,,,,,,,,,,,,,,,,,,,,,,,,,,,,,,,,,,,,,,,,,,,
1314352695445127200,1314352695445127169,2020-10-09 06:51:16 SE Asia Standard Time,2020-10-09,06:51:16,+0700,103535016,budihasan,budi hasan,,Halo apa kabarnya status PSBB? Apakah masih diperpanjang or dimulai dengan PSBB transisi lagi kah?kok gk ada kabarnya?,in,,0,0,0,https://twitter.com/budihasan/status/1314352695445127169,false,,0,,,,,,,,,,,,,,,,,,,,,,,,,,,,,,,,,,,,,,,,,,,,,,,,,,,,,,,,,,,,,,
1314247565433548800,1314247565433548801,2020-10-08 23:53:31 SE Asia Standard Time,2020-10-08,23:53:31,+0700,2917064060,lenterakris,LenteraKristiani.com,,Pergub Baru Anies: Motor Pribadi Kena Ganjil Genap Saat PSBB Transisi  https://t.co/lK5AKbgE5D,in,https://ahbnews.com/pergub-baru-anies-motor-pribadi-kena-ganjil-genap-saat-psbb-transisi/?utm_source=ReviveOldPost&utm_medium=social&utm_campaign=ReviveOldPost,0,0,0,https://twitter.com/LenteraKris/status/1314247565433548801,false,,0,,,,,,,,,,,,,,,,,,,,,,,,,,,,,,,,,,,,,,,,,,,,,,,,,,,,,,,,,,,,,,
1314227370539266000,1314227370539266048,2020-10-08 22:33:16 SE Asia Standard Time,2020-10-08,22:33:16,+0700,176324461,ikhsanndi,Sandi Ikhsan,,Nutmeg #tbt #smsfsoccer . . . . . . . . . . . . . . . . . . . . . #soccer #minisoccerjakarta #nutmeg #realmadrid #pakaimasker #jagajarak #covid_19 #psbbtransisi #appleinsta #instasport @ Vidi Mini Soccer Pulomas  https://t.co/BKnYxxqCeu,da,https://www.instagram.com/p/CGFnRlygNrm/?igshid=1av31fxie9lx5,0,0,0,https://twitter.com/ikhsanndi/status/1314227370539266048,false,,0,,,,,,,,,,,,,,,tbt,smsfsoccer,soccer,minisoccerjakarta,nutmeg,realmadrid,pakaimasker,jagajarak,covid_19,psbbtransisi,appleinsta,instasport,,,,,,,,,,,,,,,,,,,,,,,,,,,,,,,,,,,,
1314223144547229700,1314213188007682048,2020-10-08 22:16:29 SE Asia Standard Time,2020-10-08,22:16:29,+0700,1147145706395725800,visitortwt1,@visitortwt,,"@MurtadhaOne1 @Beritasatu @ainunnajib @KawalCOVID19 Mingkem mas @ainunnajib krn ginian gak ada di Singapore pandemi ya dimasa civud 19. Klu pemerintah Singapore liat demo2 gini, apa ya yg mereka lakukan? Mohon pencerahan untuk @aniesbaswedan yg kurang paham PSBB transisi itu apa. #PercayaJokowi",in,,0,0,0,https://twitter.com/visitortwt1/status/1314223144547229696,false,,0,,,,,,,,,,,,MurtadhaOne1,ꦩꦸꦂꦠꦝ,1178950184601935873,percayajokowi,,,,,,,,,,,,ainunnajib,ainun najib,35167068,aniesbaswedan,anies baswedan | sudah #vaksindulu,110312278,Beritasatu,BeritaSatu,154102750,ainunnajib,Ainun Najib,35167068,KawalCOVID19,KawalCOVID19 #62COVIDSOS,1233994338922684416,,,,,,,,,,,,,,,,,,,,,
1314204934749909000,1314204574282993664,2020-10-08 21:04:07 SE Asia Standard Time,2020-10-08,21:04:07,+0700,3129786378,kejo_online,Jasa ojek langganan orang 💉💉,,"@msvcxyz Balik ke PSBB transisi aja harusnya, toh pada rame-ramean juga.",in,,0,0,0,https://twitter.com/kejO_Online/status/1314204934749908997,false,,0,,,,,,,,,,,,,,,,,,,,,,,,,,,,,,,,,,,,,,,,,,,,,,,,,,,,,,,,,,,,,,
1314193421460934700,1314185681879490560,2020-10-08 20:18:22 SE Asia Standard Time,2020-10-08,20:18:22,+0700,1033756767644082200,dudunkcobain,ini adalah,,"@dunhillitem masih miii kmrn pas psbb transisi gue maen, skrg jg buka",in,,1,0,0,https://twitter.com/dudunkcobain/status/1314193421460934658,false,,0,,,,,,,,,,,,dunhillitem,fahmi,2201256757,,,,,,,,,,,,,,,,,,,,,,,,,,,,,,,,,,,,,,,,,,,,,,,,
1314147990211162000,1314147990211162112,2020-10-08 17:17:51 SE Asia Standard Time,2020-10-08,17:17:51,+0700,1297443086,pakaroti,Pakaroti,,"Berikut rahasia empuk Roti Naan yang merupakan roti beragi yang dibuat dari tepung gandum, yang merupakan masakan populer asal Asia Barat, Asia Tengah, Subbenua India, dan Asia Tenggara.  #Pakarians #TriviaPakaroti #AlatBaking #AlatDapur #TipsBaking #Roti #Psbb #PsbbTransisi  https://t.co/u8tKpd2smg",in,,0,0,1,https://twitter.com/PakaRoti/status/1314147990211162112,false,,1,https://pbs.twimg.com/media/EjzKoTqUYAA4Si8.jpg,,,,,,,,,,,,,,pakarians,triviapakaroti,alatbaking,alatdapur,tipsbaking,roti,psbb,psbbtransisi,,,,,,,,,,,,,,,,,,,,https://pbs.twimg.com/media/EjzKoTqUYAA4Si8.jpg,,,,,,,,,,,,,,,,,,,,
1313969672753217500,1313969672753217536,2020-10-08 05:29:17 SE Asia Standard Time,2020-10-08,05:29:17,+0700,2917064060,lenterakris,LenteraKristiani.com,,Pergub Baru Anies: Motor Pribadi Kena Ganjil Genap Saat PSBB Transisi  https://t.co/lK5AKbgE5D,in,https://ahbnews.com/pergub-baru-anies-motor-pribadi-kena-ganjil-genap-saat-psbb-transisi/?utm_source=ReviveOldPost&utm_medium=social&utm_campaign=ReviveOldPost,0,0,0,https://twitter.com/LenteraKris/status/1313969672753217536,false,,0,,,,,,,,,,,,,,,,,,,,,,,,,,,,,,,,,,,,,,,,,,,,,,,,,,,,,,,,,,,,,,
1313861873926692900,1313820884725985283,2020-10-07 22:20:55 SE Asia Standard Time,2020-10-07,22:20:55,+0700,946363405,wellylie99,polusi udara membunuhmu 🌴,,@Bisniscom Bln 3-6 kan psbb pertama. Lanjut psbb transisi. Bln 9 psbb lagi hingga tgl 10/10/2020 jelas aja import menurun krn gak ada pelaku bisnis yg buka usaha termasuk mall. Skrg aja gak ada brg dagangan krn pasokannya terputus nih. Buruknya lagi PHK uda kebanyakan khususnya jakarta,in,,0,0,2,https://twitter.com/wellylie99/status/1313861873926692864,false,,0,,,,,,,,,,,,Bisniscom,Bisnis.com,118646322,,,,,,,,,,,,,,,,,,,,,,,,,,,,,,,,,,,,,,,,,,,,,,,,
1313827302300512300,1313810004823035905,2020-10-07 20:03:33 SE Asia Standard Time,2020-10-07,20:03:33,+0700,1057158238779539500,catatankaqihati,ıʇɐɥıʞɐʞuɐʇɐʇɐƆ,,Tunggu bbrp hari lg pak @ridwankamil akan ad lonjakan. Kok gk berkaca dr Dki jkt yg mbolehkan demo saat psbb transisi kasus postifny cendrung naik drastis pak? Saya kecewa pak.  https://t.co/6iEWsJMxOP,in,,2,1,1,https://twitter.com/catatankaqihati/status/1313827302300512262,false,,1,https://pbs.twimg.com/media/Ejum9kBVgAEkTNB.jpg,,,,,,,,,,,,,,,,,,,,,,,,,,ridwankamil,ridwan kamil,80323736,,,,,,,,,,,,,https://pbs.twimg.com/media/Ejum9kBVgAEkTNB.jpg,,,,,,,,,,,,,,,,,,,,
1313748427256209400,1313748427256209409,2020-10-07 14:50:07 SE Asia Standard Time,2020-10-07,14:50:07,+0700,1198599167800533000,kodim0504,Kodim0504JakartaSelatan,,"Koramil 02 /MP dipimpin Danramil Mayor Arh Slamet   Melaksanaan Apel Tiga Pilar PSBB Transisi sesuai Pergub No.88 Tahun 2020 Tentang Pelaksanaan Pembatasan Sosial Berskala Besar Pada Masa Transisi Menuju Masyarakat Sehat, Aman dan Produktif di Wilayah Kel Pancoran.  https://t.co/H2qLi2pmJv",in,,0,0,1,https://twitter.com/kodim0504/status/1313748427256209409,false,,1,https://pbs.twimg.com/media/EjtfNS1VgAAuspR.jpg,,,,,,,,,,,,,,,,,,,,,,,,,,,,,,,,,,,,,,,,,https://pbs.twimg.com/media/EjtfNS1VgAAuspR.jpg,https://pbs.twimg.com/media/EjtfOJ_UwAEMAv1.jpg,https://pbs.twimg.com/media/EjtfOX9UwAAeADy.jpg,,,,,,,,,,,,,,,,,,
1313612160724066300,1313612160724066306,2020-10-07 05:48:39 SE Asia Standard Time,2020-10-07,05:48:39,+0700,2917064060,lenterakris,LenteraKristiani.com,,Pergub Baru Anies: Motor Pribadi Kena Ganjil Genap Saat PSBB Transisi  https://t.co/lK5AKbgE5D,in,https://ahbnews.com/pergub-baru-anies-motor-pribadi-kena-ganjil-genap-saat-psbb-transisi/?utm_source=ReviveOldPost&utm_medium=social&utm_campaign=ReviveOldPost,0,0,0,https://twitter.com/LenteraKris/status/1313612160724066306,false,,0,,,,,,,,,,,,,,,,,,,,,,,,,,,,,,,,,,,,,,,,,,,,,,,,,,,,,,,,,,,,,,
1313355958169612300,1313355958169612288,2020-10-06 12:50:36 SE Asia Standard Time,2020-10-06,12:50:36,+0700,2917064060,lenterakris,LenteraKristiani.com,,Pergub Baru Anies: Motor Pribadi Kena Ganjil Genap Saat PSBB Transisi  https://t.co/lK5AKbgE5D,in,https://ahbnews.com/pergub-baru-anies-motor-pribadi-kena-ganjil-genap-saat-psbb-transisi/?utm_source=ReviveOldPost&utm_medium=social&utm_campaign=ReviveOldPost,0,0,0,https://twitter.com/LenteraKris/status/1313355958169612288,false,,0,,,,,,,,,,,,,,,,,,,,,,,,,,,,,,,,,,,,,,,,,,,,,,,,,,,,,,,,,,,,,,
1313351922896650200,1313075733678321664,2020-10-06 12:34:33 SE Asia Standard Time,2020-10-06,12:34:33,+0700,486206650,bank_dki,bank_dki,,"@jalalsangar Selamat Siang Bpk/Ibu, mohon maaf atas ketidaknyamanannya. Dapat kami sampaikan selama PSBB transisi pelayanan Bank DKI beroperasional pukul 08.30 - 14.00 WIB.",in,,1,0,0,https://twitter.com/bank_dki/status/1313351922896650241,false,,0,,,,,,,,,,,,jalalsangar,Jalal Sofan Fitri,73826259,,,,,,,,,,,,,,,,,,,,,,,,,,,,,,,,,,,,,,,,,,,,,,,,
1313326359523909600,1313125019417939972,2020-10-06 10:52:59 SE Asia Standard Time,2020-10-06,10:52:59,+0700,3781177334,mmediocreman,👻 aaryn/SONA 👑🐃 (COMM OPEN),,"@ahjojing Wah telat bgt 3 bulan masa baru ngeh transisi psbb g ngaruh Kalo lo google ""psbb jkt sampe kapan"" Smua artikel nyingging keputusan itu utk majuin agenda personal politik anies Dan kita smua jg udh tau",in,,1,0,0,https://twitter.com/mmediocreman/status/1313326359523909632,false,,0,,,,,,,,,,,,ahjojing,a h j o @ crawling back,933785863493861376,,,,,,,,,,,,,,,,,,,,,,,,,,,,,,,,,,,,,,,,,,,,,,,,
1313283053607956500,1313283053607956480,2020-10-06 08:00:54 SE Asia Standard Time,2020-10-06,08:00:54,+0700,272841361,gadgetdivaid,Gadget Diva ID,,"Youtap mencatat transaksi non-tunai di ekosistemnya meningkat 4,5 kali lipat selama 100 hari PSBB transisi.  https://t.co/PrjFp88kj7",in,https://gadgetdiva.id/ecommerce/15011-peningkatan-transaksi-non-tunai-youtap-selama-psbb-transisi/,0,0,0,https://twitter.com/gadgetdivaID/status/1313283053607956480,false,,0,,,,,,,,,,,,,,,,,,,,,,,,,,,,,,,,,,,,,,,,,,,,,,,,,,,,,,,,,,,,,,
1313265602878816300,1313265602878816256,2020-10-06 06:51:33 SE Asia Standard Time,2020-10-06,06:51:33,+0700,85805755,mostradio1058fm,MOST RADIO 105.8 FM,,"Kadishub DKI Jakarta Syafrin Liputo menyatakan ada penurunan volume kendaraan selama pelaksanaan PSBB pengetatan sejak 14 September - 4 Oktober 2020. Rata-rata volume kendaraan mengalami penurunan sebesar 10,17 % per hari bila dibandingkan dengan PSBB transisi.#MostUpdate1058",in,,0,0,0,https://twitter.com/mostradio1058fm/status/1313265602878816256,false,,0,,,,,,,,,,,,,,,mostupdate1058,,,,,,,,,,,,,,,,,,,,,,,,,,,,,,,,,,,,,,,,,,,,,,,
1313178917277184000,1313178917277184000,2020-10-06 01:07:06 SE Asia Standard Time,2020-10-06,01:07:06,+0700,2917064060,lenterakris,LenteraKristiani.com,,Pergub Baru Anies: Motor Pribadi Kena Ganjil Genap Saat PSBB Transisi  https://t.co/lK5AKbgE5D,in,https://ahbnews.com/pergub-baru-anies-motor-pribadi-kena-ganjil-genap-saat-psbb-transisi/?utm_source=ReviveOldPost&utm_medium=social&utm_campaign=ReviveOldPost,0,0,0,https://twitter.com/LenteraKris/status/1313178917277184000,false,,0,,,,,,,,,,,,,,,,,,,,,,,,,,,,,,,,,,,,,,,,,,,,,,,,,,,,,,,,,,,,,,
1313149448269312000,1313149448269312001,2020-10-05 23:10:00 SE Asia Standard Time,2020-10-05,23:10:00,+0700,68930552,mediaindonesia,Media Indonesia,,"""Volume lalu lintas kendaraan bermotor rata-rata per hari mengalami penurunan sebesar 10,17%, dibandingkan saat pemberlakuan PSBB transisi,"" ujar Kepala Dinas Perhubungan DKI Syafrin   https://t.co/xfUaUkzYF2",in,https://mediaindonesia.com/read/detail/350363-penumpang-angkutan-umum-turun-19-selama-psbb,0,0,2,https://twitter.com/mediaindonesia/status/1313149448269312001,false,,0,,,,,,,,,,,,,,,,,,,,,,,,,,,,,,,,,,,,,,,,,,,,,,,,,,,,,,,,,,,,,,
1313121091586416600,1313086795509387265,2020-10-05 21:17:19 SE Asia Standard Time,2020-10-05,21:17:19,+0700,354736167,mirzamau,Mirz,,"@RiyanGGMU @ItsGRT_ @dimasdzarkazi @detikcom @undip @Unair_Official I know, saya cuma mempertanyakan ngapain psbb total lagi kalau angka nya sama aja kaya psbb transisi + psbb total bikin banyak phk",in,,0,0,0,https://twitter.com/Mirzamau/status/1313121091586416641,false,,0,,,,,,,,,,,,RiyanGGMU,MRF.,1461562610,,,,,,,,,,,,,,,,,,,ItsGRT_,Renan,1900938944,dimasdzarkazi,dimas wisnu,116107707,detikcom,detikcom,69183155,,,,undip,Universitas Diponegoro,2951332278,Unair_Official,Universitas Airlangga,1110709339,,,,,,,,,,,,
1313105891407786000,1313086795509387265,2020-10-05 20:16:55 SE Asia Standard Time,2020-10-05,20:16:55,+0700,2601050466,azielindra,aziel indra effendi,,"@Mirzamau @NyooCarol13 @detikcom Psbb bukan milik Anies. Psbb itu buatan Jokowi, cek sejarahnya. Cek juga psbb transisi. Orang itu sembuhin dulu p3nyakitnya baru kerja",in,,0,0,2,https://twitter.com/azielindra/status/1313105891407785984,false,,0,,,,,,,,,,,,Mirzamau,Mirz,354736167,,,,,,,,,,,,,,,,,,,NyooCarol13,#StaySafeStaySane 🙌,1261985862058795009,detikcom,detikcom,69183155,,,,,,,,,,,,,,,,,,,,,,,,
1313104696446316500,1313086795509387265,2020-10-05 20:12:10 SE Asia Standard Time,2020-10-05,20:12:10,+0700,354736167,mirzamau,Mirz,,"@NyooCarol13 @detikcom Bukan apa2 Anies disalahin, tapi jelas bgt psbb ini salah Anies. Lagi pemulihan ekonomi, psbb lagi yang angkanya sama aja kaya transisi kemarin. Bedanya? Skrg Ekonomi rontok, phk dimana2, orang gatau beli makan pake apa.",in,,2,0,0,https://twitter.com/Mirzamau/status/1313104696446316544,false,,0,,,,,,,,,,,,NyooCarol13,#StaySafeStaySane 🙌,1261985862058795009,,,,,,,,,,,,,,,,,,,detikcom,detikcom,69183155,,,,,,,,,,,,,,,,,,,,,,,,,,,
1313081020929851400,1313081020929851392,2020-10-05 18:38:05 SE Asia Standard Time,2020-10-05,18:38:05,+0700,23343960,kompascom,Kompas.com,,"Selama periode 14 September hingga 4 Oktober 2020, rata-rata volume kendaraan per hari di Jakarta turun 10,17 persen dibanding saat PSBB masa transisi  https://t.co/wIytXmupzm",in,http://dlvr.it/RhzCcY,0,1,0,https://twitter.com/kompascom/status/1313081020929851392,false,,0,,,,,,,,,,,,,,,,,,,,,,,,,,,,,,,,,,,,,,,,,,,,,,,,,,,,,,,,,,,,,,
1313077741835612200,1313077741835612161,2020-10-05 18:25:04 SE Asia Standard Time,2020-10-05,18:25:04,+0700,23343960,kompascom,Kompas.com,,"Selama periode 14 September hingga 4 Oktober 2020, rata-rata volume kendaraan per hari di Jakarta turun 10,17 persen dibanding saat PSBB masa transisi  https://t.co/CaiyC6Cxxg",in,http://dlvr.it/Rhz9WJ,0,0,3,https://twitter.com/kompascom/status/1313077741835612161,false,,0,,,,,,,,,,,,,,,,,,,,,,,,,,,,,,,,,,,,,,,,,,,,,,,,,,,,,,,,,,,,,,
1312972894998163500,1312972894998163457,2020-10-05 11:28:26 SE Asia Standard Time,2020-10-05,11:28:26,+0700,584590031,nadiadmynti,Nadia Damayanti,,"Kayaknya di luar cuma mengenal istilah lockdown ya.  Kok di Indonesia ada macam-macam istilahnya. PSBB lah, PSBB transisi lah, yg terbaru tadi (baru ku tau) ada PSBK. Pembatasan Sosial Berskala Kampung.  😳🙄",in,,0,0,0,https://twitter.com/nadiadmynti/status/1312972894998163457,false,,0,,,,,,,,,,,,,,,,,,,,,,,,,,,,,,,,,,,,,,,,,,,,,,,,,,,,,,,,,,,,,,
1312958281187430400,1312889075540455424,2020-10-05 10:30:22 SE Asia Standard Time,2020-10-05,10:30:22,+0700,1379431842,mrsrachelin,indri Yahya⚘🇮🇩🕊,,"@erwinkuswandi19 Ya, pusat bilang psbb new normal ' ini psbb transisi...slalu beda ..",in,,0,0,0,https://twitter.com/MrsRachelIn/status/1312958281187430400,false,,0,,,,,,,,,,,,erwinkuswandi19,win kus 🇮🇩,4493217314,,,,,,,,,,,,,,,,,,,,,,,,,,,,,,,,,,,,,,,,,,,,,,,,
1312912478251212800,1312912478251212800,2020-10-05 07:28:22 SE Asia Standard Time,2020-10-05,07:28:22,+0700,2917064060,lenterakris,LenteraKristiani.com,,Pergub Baru Anies: Motor Pribadi Kena Ganjil Genap Saat PSBB Transisi  https://t.co/lK5AKbgE5D,in,https://ahbnews.com/pergub-baru-anies-motor-pribadi-kena-ganjil-genap-saat-psbb-transisi/?utm_source=ReviveOldPost&utm_medium=social&utm_campaign=ReviveOldPost,0,0,0,https://twitter.com/LenteraKris/status/1312912478251212800,false,,0,,,,,,,,,,,,,,,,,,,,,,,,,,,,,,,,,,,,,,,,,,,,,,,,,,,,,,,,,,,,,,
1312781277158756400,1312778102196506624,2020-10-04 22:47:01 SE Asia Standard Time,2020-10-04,22:47:01,+0700,1156342802122363000,aguset19,Agus setiawan,,"Pas pertamatama PSBB awal diberlakuin, kita semua lumayan patuh. Hampir gaada orang yang nongkrong, hampir semua tempat makan tutup dan gak menyediakan makan di tempat. Tapi, seiring berjalannya waktu. Presiden mengumumkan New Normal yang mengakibatkan Jakarta PSBB Transisi.",in,,1,0,0,https://twitter.com/aguset19/status/1312781277158756352,false,,0,,,,,,,,,,,,,,,,,,,,,,,,,,,,,,,,,,,,,,,,,,,,,,,,,,,,,,,,,,,,,,
1312702583673417700,1312702583673417728,2020-10-04 17:34:19 SE Asia Standard Time,2020-10-04,17:34:19,+0700,2917064060,lenterakris,LenteraKristiani.com,,Pergub Baru Anies: Motor Pribadi Kena Ganjil Genap Saat PSBB Transisi  https://t.co/lK5AKbgE5D,in,https://ahbnews.com/pergub-baru-anies-motor-pribadi-kena-ganjil-genap-saat-psbb-transisi/?utm_source=ReviveOldPost&utm_medium=social&utm_campaign=ReviveOldPost,0,0,0,https://twitter.com/LenteraKris/status/1312702583673417728,false,,0,,,,,,,,,,,,,,,,,,,,,,,,,,,,,,,,,,,,,,,,,,,,,,,,,,,,,,,,,,,,,,
1312689899351363600,1312685219321765891,2020-10-04 16:43:55 SE Asia Standard Time,2020-10-04,16:43:55,+0700,12450932,alandakariza,Get your vaccine 💉,,@yeyenniish Sempet buka pas baru PSBB transisi. Aku harusnya April tapi diundur terus sampai akhirnya jadi awal Juni.,in,,1,0,0,https://twitter.com/alandakariza/status/1312689899351363589,false,,0,,,,,,,,,,,,yeyenniish,Yeyen Yenuarizki,1228192033853988865,,,,,,,,,,,,,,,,,,,,,,,,,,,,,,,,,,,,,,,,,,,,,,,,
1312632131340787700,1312607847948062722,2020-10-04 12:54:22 SE Asia Standard Time,2020-10-04,12:54:22,+0700,1356653520,riefsinggih,arief p singgih,,@y_wijayanto Aku sudah 6 bulan nggak keluar rumah....baru kemaren ke Jakarta.... itu pun harus keluar sebelum 14 September takut kejebak New PSBB Total...😂😂😂 Weleh Weleh.... ternyata eh ternyata....Ndak ono bedhane ambek Transisi....😂😂😂 Wes angel....angel....angel..,in,,1,0,0,https://twitter.com/riefsinggih/status/1312632131340787712,false,,0,,,,,,,,,,,,y_wijayanto,widi wijayanto,2199107286,,,,,,,,,,,,,,,,,,,,,,,,,,,,,,,,,,,,,,,,,,,,,,,,
1312614907024556000,1312601727296659456,2020-10-04 11:45:55 SE Asia Standard Time,2020-10-04,11:45:55,+0700,729455396738322400,raanoo_____,Monsieur 🇮🇩,,"@urdadsnobodies tunggu psbb transisi apa susanya si anjg, kek mati aja org org itu klo ga nongkrong",in,,0,0,0,https://twitter.com/raanoo_____/status/1312614907024556032,false,,0,,,,,,,,,,,,,,,,,,,,,,,,,,,,,,,,,,,,,,,,,,,,,,,,,,,,,,,,,,,,,,
1312573141214883800,1312571731677114368,2020-10-04 08:59:57 SE Asia Standard Time,2020-10-04,08:59:57,+0700,946634228967489500,afagvrl,sha,,@diyantimar Waktu psbb transisi dibuka tu tp cuma 1000 pengunjung dan harus download apps apa gt. Kyanya sekarang iya deh closed,in,,1,0,0,https://twitter.com/afagvrl/status/1312573141214883840,false,,0,,,,,,,,,,,,diyantimar,iyaaaann😾,1302605188373442560,,,,,,,,,,,,,,,,,,,,,,,,,,,,,,,,,,,,,,,,,,,,,,,,
1312498817384603600,1312498817384603649,2020-10-04 04:04:37 SE Asia Standard Time,2020-10-04,04:04:37,+0700,2917064060,lenterakris,LenteraKristiani.com,,Pergub Baru Anies: Motor Pribadi Kena Ganjil Genap Saat PSBB Transisi  https://t.co/lK5AKaZ2H3,in,https://ahbnews.com/pergub-baru-anies-motor-pribadi-kena-ganjil-genap-saat-psbb-transisi/?utm_source=ReviveOldPost&utm_medium=social&utm_campaign=ReviveOldPost,0,0,0,https://twitter.com/LenteraKris/status/1312498817384603649,false,,0,,,,,,,,,,,,,,,,,,,,,,,,,,,,,,,,,,,,,,,,,,,,,,,,,,,,,,,,,,,,,,
1312405251987660800,1312405251987660802,2020-10-03 21:52:50 SE Asia Standard Time,2020-10-03,21:52:50,+0700,147580468,perrykusumah,₱€®®¥,,"PSBB...Transisi...PSBB..., tarik...ulur...tarik..., kayak ngadu layangan...Tarik2 betot sekalian..jangan tanggung2!  Wuhan lockdown 2 bulan sekarang udah new normal! 😷",in,,0,0,0,https://twitter.com/perrykusumah/status/1312405251987660802,false,,0,,,,,,,,,,,,,,,,,,,,,,,,,,,,,,,,,,,,,,,,,,,,,,,,,,,,,,,,,,,,,,
1312306167360577500,1312306167360577536,2020-10-03 15:19:06 SE Asia Standard Time,2020-10-03,15:19:06,+0700,58722068,ditto_p,Ditto Priyawardhana,,"PSBB, PSBB transisi, PSBB ketat, AKB, ATHB 🤣🤣🤣🤣",in,,0,0,0,https://twitter.com/ditto_p/status/1312306167360577536,false,https://twitter.com/kompascom/status/1312303256773689344,0,,,,,,,,,,,,,,,,,,,,,,,,,,,,,,,,,,,,,,,,,,,,,,,,,,,,,,,,,,,,,,
1312296392543666200,1312296392543666176,2020-10-03 14:40:15 SE Asia Standard Time,2020-10-03,14:40:15,+0700,2917064060,lenterakris,LenteraKristiani.com,,Pergub Baru Anies: Motor Pribadi Kena Ganjil Genap Saat PSBB Transisi  https://t.co/lK5AKbgE5D,in,https://ahbnews.com/pergub-baru-anies-motor-pribadi-kena-ganjil-genap-saat-psbb-transisi/?utm_source=ReviveOldPost&utm_medium=social&utm_campaign=ReviveOldPost,0,0,0,https://twitter.com/LenteraKris/status/1312296392543666176,false,,0,,,,,,,,,,,,,,,,,,,,,,,,,,,,,,,,,,,,,,,,,,,,,,,,,,,,,,,,,,,,,,
1312264261654044700,1312264261654044672,2020-10-03 12:32:35 SE Asia Standard Time,2020-10-03,12:32:35,+0700,1086650434251411500,richietan13,Richie Tan,,Proses ganti kulit pada hewan  https://t.co/ti3oeuXkxu #psbb #covid19 #corona #jakarta #pemerintah #psbbnewnormal #psbbtotal #sanksisosial #psbbtransisi #pelanggarpsbb #masker #hatihati #pelanggarpsbb #tidakpakaimasker #bersihkankali #aturanpsbbterbaru #sanksipsbb,in,https://youtu.be/hGo586jzNic,0,0,0,https://twitter.com/RichieTan13/status/1312264261654044672,false,,0,,,,,,,,,,,,,,,psbb,covid19,corona,jakarta,pemerintah,psbbnewnormal,psbbtotal,sanksisosial,psbbtransisi,pelanggarpsbb,masker,hatihati,,,,,,,,,,,,,,,,,,,,,,,,,pelanggarpsbb,tidakpakaimasker,bersihkankali,aturanpsbbterbaru,sanksipsbb,,,,,,,
1312229772932472800,1312229772932472832,2020-10-03 10:15:32 SE Asia Standard Time,2020-10-03,10:15:32,+0700,973230634893103100,economiczone_id,Economic Zone,,"100 Hari PSBB Transisi: Naik Hingga 4,5 Kali Lipat, Teknologi Nirsentuh Jadi Pilihan Aman: Usaha pemulihan ekonomi dan perkembangan inovasi digital untuk membantu para UMKM bertahan melewati masa pandemi Covid-19 ini terus diberikan baik oleh pemerintah…  https://t.co/3QSYZCu3ga",in,http://dlvr.it/Rhrj8w,0,0,0,https://twitter.com/economiczone_id/status/1312229772932472832,false,,0,,,,,,,,,,,,,,,,,,,,,,,,,,,,,,,,,,,,,,,,,,,,,,,,,,,,,,,,,,,,,,
