1312150468458553300,1312150468458553346,2020-10-03 05:00:24 SE Asia Standard Time,2020-10-03,05:00:24,+0700,2917064060,lenterakris,LenteraKristiani.com,,Pergub Baru Anies: Motor Pribadi Kena Ganjil Genap Saat PSBB Transisi  https://t.co/lK5AKaZ2H3,in,https://ahbnews.com/pergub-baru-anies-motor-pribadi-kena-ganjil-genap-saat-psbb-transisi/?utm_source=ReviveOldPost&utm_medium=social&utm_campaign=ReviveOldPost,0,0,0,https://twitter.com/LenteraKris/status/1312150468458553346,false,,0,,,,,,,,,,,,,,,,,,,,,,,,,,,,,,,,,,,,,,,,,,,,,,,,,,,,,,,,,,,,,,
1312093431687270400,1312093431687270407,2020-10-03 01:13:46 SE Asia Standard Time,2020-10-03,01:13:46,+0700,2917064060,lenterakris,LenteraKristiani.com,,Pergub Baru Anies: Motor Pribadi Kena Ganjil Genap Saat PSBB Transisi  https://t.co/lK5AKbgE5D,in,https://ahbnews.com/pergub-baru-anies-motor-pribadi-kena-ganjil-genap-saat-psbb-transisi/?utm_source=ReviveOldPost&utm_medium=social&utm_campaign=ReviveOldPost,0,0,0,https://twitter.com/LenteraKris/status/1312093431687270407,false,,0,,,,,,,,,,,,,,,,,,,,,,,,,,,,,,,,,,,,,,,,,,,,,,,,,,,,,,,,,,,,,,
1312073027106955300,1311931703049428994,2020-10-02 23:52:41 SE Asia Standard Time,2020-10-02,23:52:41,+0700,82167809,ayahhasann,...,,@el_kaezzar @callmeleraa @detikcom @dewanpers @AJIIndonesia Di saat PSBB pertama dan PSBB transisi awal Jakarta kayanya lumayan sukses nahan laju covid-19. Padahal PSBB itu bukan lockdown tapi Jakarta sepi yg artinya warga nerima gerak dibatasi. Tapi mgkn krn ga jelas endingnya dan warga butuh makan akhirnya jadi naik lagi kaya skrg.,in,,1,0,0,https://twitter.com/ayahhasann/status/1312073027106955264,false,,0,,,,,,,,,,,,el_kaezzar,Aldie,709914044,,,,,,,,,,,,,,,,,,,callmeleraa,ראביל רזקי,1120212391566856192,detikcom,detikcom,69183155,dewanpers,Dewan Pers,256912313,,,,AJIIndonesia,AJI Indonesia,289782151,,,,,,,,,,,,,,,
1312067442084962300,1312067442084962304,2020-10-02 23:30:29 SE Asia Standard Time,2020-10-02,23:30:29,+0700,991760263228477400,drnewstwit,drn,,"Berbagi kabar baik mengenai COVID 19:  Pasien rawat inap di Jakarta yg menderita COVID-19 sempat mencapai hampir 5.000 orang pada saat PSBB Transisi.  Terjadi penurunan Pasien rawat inap di Jakarta yg menderita COVID-19, jadi hampir 2.000 orang.  Semoga Pandemi segera berakhir.  https://t.co/Q7MHkuskz0",in,,2,3,12,https://twitter.com/drnewstwit/status/1312067442084962304,false,,1,https://pbs.twimg.com/media/EjVmYVfVkAErTGG.jpg,,,,,,,,,,,,,,,,,,,,,,,,,,,,,,,,,,,,,,,,,https://pbs.twimg.com/media/EjVmYVfVkAErTGG.jpg,,,,,,,,,,,,,,,,,,,,
1312013163294941200,1312011421220139008,2020-10-02 19:54:48 SE Asia Standard Time,2020-10-02,19:54:48,+0700,3129786378,kejo_online,Jasa ojek langganan orang 💉💉,,"@joki_berbakat Prakerja udah dari sebelum pandemi dipersiapkan.  Sedangkan yang tadi Lo bilang itu udah dijawab sama Pak @prastow dananya baru tersedia di pertengahan bulan Juni, yang sudah masuk PSBB transisi.",in,,2,0,0,https://twitter.com/kejO_Online/status/1312013163294941184,false,,0,,,,,,,,,,,,joki_berbakat,NiDaMi_,900033730361688064,,,,,,,,,,,,,prastow,prastowo yustinus,88581196,,,,,,,,,,,,,,,,,,,,,,,,,,,,,,,,,
1312008712496668700,1312008712496668678,2020-10-02 19:37:07 SE Asia Standard Time,2020-10-02,19:37:07,+0700,58880688,pikiran_rakyat,Pikiran Rakyat,,"Data Ini Muncul, 1.623 WNA Tiongkok Masuk Jakarta saat PSBB Transisi Agustus 2020  https://t.co/zTCAX0hTD0",in,http://dlvr.it/RhpXNN,0,2,1,https://twitter.com/pikiran_rakyat/status/1312008712496668678,false,,0,,,,,,,,,,,,,,,,,,,,,,,,,,,,,,,,,,,,,,,,,,,,,,,,,,,,,,,,,,,,,,
1312001351073902600,1312001351073902593,2020-10-02 19:07:52 SE Asia Standard Time,2020-10-02,19:07:52,+0700,408258254,vitrosss,Vita Rossanti,,"Year 2020 BC (Before Corona)  Tahun yang hanya memiliki 2 bulan, yaitu Januari dan Februari. Sisanya PSBB, PSBB transisi dan PSBB lagi.  Stay safe, stay sane!  https://t.co/dTF57d7xQe",in,https://www.instagram.com/p/CF1y_-Sj7Bz/?igshid=1e3g3g4z2o7h7,0,0,0,https://twitter.com/vitrosss/status/1312001351073902593,false,,0,,,,,,,,,,,,,,,,,,,,,,,,,,,,,,,,,,,,,,,,,,,,,,,,,,,,,,,,,,,,,,
1311995145835835400,1311953327546986496,2020-10-02 18:43:13 SE Asia Standard Time,2020-10-02,18:43:13,+0700,4543162348,saptasahasrani,Rian Nugraha,,"@ellameilia @BNPB_Indonesia Coba perhatikan, sama persis tidak PSBB kali ini dengan PSBB awal dulu? PSBB yang sekarang ini tetap lebih longgar, walaupun lebih ketat dibandingkan PSBB transisi. Perlu dievaluasi &amp; segera modifikasi supaya lebih efektif. Jika 3 minggu tanpa aksi perubahan akan percuma nantinya",in,,1,0,0,https://twitter.com/SaptaSahasrani/status/1311995145835835393,false,,0,,,,,,,,,,,,ellameilia,Ella Meilia,134315121,,,,,,,,,,,,,,,,,,,BNPB_Indonesia,BNPB Indonesia,346303384,,,,,,,,,,,,,,,,,,,,,,,,,,,
1311983195450089500,1311983195450089472,2020-10-02 17:55:43 SE Asia Standard Time,2020-10-02,17:55:43,+0700,86658493,danang_soegi,Danang Sugi Atmojo,,"PSBB,PSBB transisi, minilockdown....nanti juga sampe ke LOCKDOWN!",in,,0,0,0,https://twitter.com/danang_soegi/status/1311983195450089472,false,https://twitter.com/CNNIndonesia/status/1311772998215495681,0,,,,,,,,,,,,,,,,,,,,,,,,,,,,,,,,,,,,,,,,,,,,,,,,,,,,,,,,,,,,,,
1311951347206422500,1311944775143022592,2020-10-02 15:49:10 SE Asia Standard Time,2020-10-02,15:49:10,+0700,2558425814,postkelonial,dini,,@tiuwtiw Gak jauh beda dr psbb pertama dong ya suasananya? (Gak bisa bedain juga aku sm psbb transisi 😢),in,,0,0,0,https://twitter.com/postkelonial/status/1311951347206422528,false,,0,,,,,,,,,,,,tiuwtiw,Simbok Tiwi,2662512480,,,,,,,,,,,,,,,,,,,,,,,,,,,,,,,,,,,,,,,,,,,,,,,,
1311930199651446800,1311930199651446784,2020-10-02 14:25:08 SE Asia Standard Time,2020-10-02,14:25:08,+0700,42599126,glazedribeye,"but Gal, why can't we just steal more furniture?",,PSBB PSBB transisi PSBB jilid II PSBB mini lockdown PSBB jilid II + mini lockdown final mix PSBB 385/2 days PSBB chain of memories PSBB birth by sleep PSBB re:coded PSBB dream drop distance PSBB 2.8 final chapter prologue  PSBB jilid III  https://t.co/M1BkXDxfoR,in,,0,1,1,https://twitter.com/glazedribeye/status/1311930199651446784,false,https://twitter.com/detikcom/status/1311924181681012736,1,https://pbs.twimg.com/tweet_video_thumb/EjTpjn0VcAAOYE_.jpg,,,,,,,,,,,,,,,,,,,,,,,,,,,,,,,,,,,,,,,,,https://pbs.twimg.com/tweet_video_thumb/EjTpjn0VcAAOYE_.jpg,,,,,,,,,,,,,,,,,,,,
1311873053664727000,1311873053664727040,2020-10-02 10:38:04 SE Asia Standard Time,2020-10-02,10:38:04,+0700,2917064060,lenterakris,LenteraKristiani.com,,Pergub Baru Anies: Motor Pribadi Kena Ganjil Genap Saat PSBB Transisi  https://t.co/lK5AKbgE5D,in,https://ahbnews.com/pergub-baru-anies-motor-pribadi-kena-ganjil-genap-saat-psbb-transisi/?utm_source=ReviveOldPost&utm_medium=social&utm_campaign=ReviveOldPost,0,0,0,https://twitter.com/LenteraKris/status/1311873053664727040,false,,0,,,,,,,,,,,,,,,,,,,,,,,,,,,,,,,,,,,,,,,,,,,,,,,,,,,,,,,,,,,,,,
1311685241896161300,1311685241896161282,2020-10-01 22:11:46 SE Asia Standard Time,2020-10-01,22:11:46,+0700,2917064060,lenterakris,LenteraKristiani.com,,Pergub Baru Anies: Motor Pribadi Kena Ganjil Genap Saat PSBB Transisi  https://t.co/lK5AKbgE5D,in,https://ahbnews.com/pergub-baru-anies-motor-pribadi-kena-ganjil-genap-saat-psbb-transisi/?utm_source=ReviveOldPost&utm_medium=social&utm_campaign=ReviveOldPost,0,0,0,https://twitter.com/LenteraKris/status/1311685241896161282,false,,0,,,,,,,,,,,,,,,,,,,,,,,,,,,,,,,,,,,,,,,,,,,,,,,,,,,,,,,,,,,,,,
1311654819963129900,1311654819963129856,2020-10-01 20:10:53 SE Asia Standard Time,2020-10-01,20:10:53,+0700,1086650434251411500,richietan13,Richie Tan,, https://t.co/dAt8kgIn45 Dr TIRTA PART 6 'MASKER SNI DAN PSBB JAKARTA' #psbb #maskersni #covid19 #corona #jakarta #pemerintah #psbbnewnormal #sanksisosial #psbbtransisi #pelanggarpsbb #masker #hatihati #pelanggarpsbb #tidakpakaimasker #bersihkankali #aturanpsbbterbaru #sanksipsbb,in,https://youtu.be/fPlWsmgXDK4,0,0,0,https://twitter.com/RichieTan13/status/1311654819963129856,false,,0,,,,,,,,,,,,,,,psbb,maskersni,covid19,corona,jakarta,pemerintah,psbbnewnormal,sanksisosial,psbbtransisi,pelanggarpsbb,masker,hatihati,,,,,,,,,,,,,,,,,,,,,,,,,pelanggarpsbb,tidakpakaimasker,bersihkankali,aturanpsbbterbaru,sanksipsbb,,,,,,,
1311653173434617900,1311647115928432641,2020-10-01 20:04:20 SE Asia Standard Time,2020-10-01,20:04:20,+0700,234586131,alfamaulana01,Alfa Maulana,,"@drpriono1 Setuju dok, hrs psbb ketat di jkt spt yg dulu. Klo skrg sdh longgar, bebas kyk psbb transisi. Mengandalkan masy, mustahil. Tinggal Gov, cm klo yg skrg y......mdh2 ada perubahan lah..",in,,0,0,0,https://twitter.com/Alfamaulana01/status/1311653173434617857,false,,0,,,,,,,,,,,,drpriono1,Juru Wabah 🇮🇩,1297362611026059269,,,,,,,,,,,,,,,,,,,,,,,,,,,,,,,,,,,,,,,,,,,,,,,,
1311639824286113800,1311638799005310976,2020-10-01 19:11:17 SE Asia Standard Time,2020-10-01,19:11:17,+0700,4329003615,psi_jakarta,PSI JAKARTA | #BeraniVaksinSehat,,3.Meminta Pemprov melengkapi pemberlakuan PSBB &amp; PSBB Transisi dgn indikator2 pemberlakuan yg jelas &amp; terukur  4.Meminta Pemprov melengkapi beberapa definisi terkait rencana pemulihan ekonomi serta perlindungan sosial &amp; jaminan sosial  https://t.co/LxuNnNlAAC,in,,3,4,2,https://twitter.com/PSI_Jakarta/status/1311639824286113792,false,,1,https://pbs.twimg.com/ext_tw_video_thumb/1311639747106758656/pu/img/6OnmnZSXJBfjShyN.jpg,,,,,,,,,,,,,,,,,,,,,,,,,,,,,,,,,,,,,,,,,,,,,,,,,,,,,,,,,,,,,
1311627154061492200,1311627154061492224,2020-10-01 18:20:57 SE Asia Standard Time,2020-10-01,18:20:57,+0700,62054489,jerayawara,Onerazz Channel Services,,"Dalam kurun waktu 14 hari PSBB ketat, jumlah korban tewas mencapai 14 orang atau naik 40 persen dibanding periode sama pada masa PSBB transisi. #PSBBJakarta  https://t.co/QEe6fqiOPZ  https://t.co/YoujiHQZ4o",in,https://news.detik.com/berita/d-5195801/polisi-korban-tewas-kecelakaan-di-masa-psbb-ketat-jakarta-naik-40-persen?utm_content=detikcom&utm_term=echobox&utm_medium=oa&utm_campaign=detikcomsocmed&utm_source=Twitter#Echobox=1601541584,0,0,0,https://twitter.com/jerayawara/status/1311627154061492224,false,,0,,,,,,,,,,,,,,,psbbjakarta,,,,,,,,,,,,,,,,,,,,,,,,,,,,,,,,,,,,,,,,,https://onerazzchannelservices.wordpress.com/2020/10/01/dalam-kurun-waktu-14-hari-psbb-ketat-jumlah-korban-tewas-mencapai-14-orang-atau-naik-40-persen-dibanding-periode-sama-pada-masa-psbb-transisi-psbbjakarta-https-t-co-mvxwb4hpyo/,,,,,,
1311627151230349300,1311627151230349312,2020-10-01 18:20:56 SE Asia Standard Time,2020-10-01,18:20:56,+0700,3145585729,onerazz,OCS Channel,,"Dalam kurun waktu 14 hari PSBB ketat, jumlah korban tewas mencapai 14 orang atau naik 40 persen dibanding periode sama pada masa PSBB transisi. #PSBBJakarta  https://t.co/mXpynpVNwz  https://t.co/yIausKZ0YJ",in,https://news.detik.com/berita/d-5195801/polisi-korban-tewas-kecelakaan-di-masa-psbb-ketat-jakarta-naik-40-persen?utm_content=detikcom&utm_term=echobox&utm_medium=oa&utm_campaign=detikcomsocmed&utm_source=Twitter#Echobox=1601541584,0,0,0,https://twitter.com/onerazz/status/1311627151230349312,false,,0,,,,,,,,,,,,,,,psbbjakarta,,,,,,,,,,,,,,,,,,,,,,,,,,,,,,,,,,,,,,,,,https://onerazzchannelservices.wordpress.com/2020/10/01/dalam-kurun-waktu-14-hari-psbb-ketat-jumlah-korban-tewas-mencapai-14-orang-atau-naik-40-persen-dibanding-periode-sama-pada-masa-psbb-transisi-psbbjakarta-https-t-co-mvxwb4hpyo/,,,,,,
1311610596261941200,1311610596261941249,2020-10-01 17:15:09 SE Asia Standard Time,2020-10-01,17:15:09,+0700,1297443086,pakaroti,Pakaroti,,Puff St. Honore Asal Prancis Atau Belgia?  #Pakarians #TriviaPakaroti #Trivia #InfoBaking #InfoKuliner #InfoMakanan #Cake #Pastry #Baking #Psbb #PsbbTransisi  https://t.co/z7qnLoqOiP,en,,0,0,0,https://twitter.com/PakaRoti/status/1311610596261941249,false,,1,https://pbs.twimg.com/media/EjPG4bTUYAEJS8N.jpg,,,,,,,,,,,,,,pakarians,triviapakaroti,trivia,infobaking,infokuliner,infomakanan,cake,pastry,baking,psbb,psbbtransisi,,,,,,,,,,,,,,,,,https://pbs.twimg.com/media/EjPG4bTUYAEJS8N.jpg,,,,,,,,,,,,,,,,,,,,
1311589028597129200,1311589028597129216,2020-10-01 15:49:27 SE Asia Standard Time,2020-10-01,15:49:27,+0700,1198599167800533000,kodim0504,Kodim0504JakartaSelatan,,Operasi Yustisi 3 Pilar Tingkat Provinsi DKI Jakarta dalam rangka Kamtibmas serta penerapan PSBB transisi tahap kedua menuju tatanan baru di wilayah Koramil 06/Setiabudi.Menjaring 30 pelanggar Protokol Kesehatan  https://t.co/EnsE9iTHdt,in,,0,0,0,https://twitter.com/kodim0504/status/1311589028597129216,false,,1,https://pbs.twimg.com/media/EjOzRQHU8AETQCF.jpg,,,,,,,,,,,,,,,,,,,,,,,,,,,,,,,,,,,,,,,,,https://pbs.twimg.com/media/EjOzRQHU8AETQCF.jpg,,,,,,,,,,,,,,,,,,,,
1311588356304908300,1311588356304908289,2020-10-01 15:46:46 SE Asia Standard Time,2020-10-01,15:46:46,+0700,69183155,detikcom,detikcom,,"Dalam kurun waktu 14 hari PSBB ketat, jumlah korban tewas mencapai 14 orang atau naik 40 persen dibanding periode sama pada masa PSBB transisi. #PSBBJakarta  https://t.co/MvXWB4hPYo",in,https://news.detik.com/berita/d-5195801/polisi-korban-tewas-kecelakaan-di-masa-psbb-ketat-jakarta-naik-40-persen?utm_content=detikcom&utm_term=echobox&utm_medium=oa&utm_campaign=detikcomsocmed&utm_source=Twitter#Echobox=1601541584,0,1,7,https://twitter.com/detikcom/status/1311588356304908289,false,,0,,,,,,,,,,,,,,,psbbjakarta,,,,,,,,,,,,,,,,,,,,,,,,,,,,,,,,,,,,,,,,,,,,,,,
1311586233810776000,1311572016277807104,2020-10-01 15:38:20 SE Asia Standard Time,2020-10-01,15:38:20,+0700,243582081,reyand22,Drey,,"@FiersaBesari Banyak istilah doang, psbb, psbb transisi, new normal, mini lockdown, efek gak seberapa.",in,,0,0,0,https://twitter.com/reyand22/status/1311586233810776065,false,,0,,,,,,,,,,,,FiersaBesari,Fiersa Besari,1422951168,,,,,,,,,,,,,,,,,,,,,,,,,,,,,,,,,,,,,,,,,,,,,,,,
1311584144632082400,1311584144632082433,2020-10-01 15:30:02 SE Asia Standard Time,2020-10-01,15:30:02,+0700,456426648,merdekadotcom,Merdeka.com,,Polisi Sebut Selama PSBB Ketat Jumlah Korban Kecelakaan Meningkat 40 Persen: Sambodo mengatakan perbandingan jumlah korban tewas akibat kecelakaan itu selama 14 hari periode PSBB Transisi (31 Agustus-14 September) sebanyak 10 orang. Sedangkan saat PSBB…  https://t.co/OLXBgiRVVL,in,http://dlvr.it/Rhjxpd,0,0,1,https://twitter.com/merdekadotcom/status/1311584144632082433,false,,0,,,,,,,,,,,,,,,,,,,,,,,,,,,,,,,,,,,,,,,,,,,,,,,,,,,,,,,,,,,,,,
1311583263874445300,1311583040875851776,2020-10-01 15:26:32 SE Asia Standard Time,2020-10-01,15:26:32,+0700,271922617,ridhaintifadha,M. Ridha Intifadha,,Dua kali masa PSBB di Jakarta setidaknya membuktikan penurunan signifikan keterisian di RS. Pola penurunan terlihat di awal bulan Juli dan pertengahan September  Semoga pola penurunan keterisian ini tidak serta merta mjd dasar pembukaan masa Transisi sblm wabah benar2 terkendali  https://t.co/CP8LUa3dhL,in,,1,13,21,https://twitter.com/RidhaIntifadha/status/1311583263874445317,false,,1,https://pbs.twimg.com/media/EjOuBPYVkAAb5rA.jpg,,,,,,,,,,,,,,,,,,,,,,,,,,,,,,,,,,,,,,,,,https://pbs.twimg.com/media/EjOuBPYVkAAb5rA.jpg,,,,,,,,,,,,,,,,,,,,
1311576594079604700,1311576594079604737,2020-10-01 15:00:02 SE Asia Standard Time,2020-10-01,15:00:02,+0700,79130206,jpnncom,JPNN.com,,"Polisi mencatatkan ada kenaikan jumlah korban kecelakaan lalu lintas sekitar 40 persen selama penerapan PSBB Jakarta, dibanding saat Transisi. #jumlahkorbankecelakaanselamapsbbJakarta  https://t.co/TjBgADG7Xy",in,https://m.jpnn.com/news/volume-kendaraan-turun-tetapi-jumlah-korban-kecelakaan-naik-40-persen,0,0,0,https://twitter.com/jpnncom/status/1311576594079604737,false,,0,,,,,,,,,,,,,,,jumlahkorbankecelakaanselamapsbbjakarta,,,,,,,,,,,,,,,,,,,,,,,,,,,,,,,,,,,,,,,,,,,,,,,
1311570833513406500,1311570833513406465,2020-10-01 14:37:09 SE Asia Standard Time,2020-10-01,14:37:09,+0700,72884031,professordeka,Deka,,"Lockdown in scale  Lockdown (I.e : italia, malaysia) Regional Lockdown (I.e wuhan) Lockdown gk yah ? (I.e PSBB) BOsen lockdown gak ada duit cicilan banyak (I.e AKB/PSBB transisi) ""mini lockdown"" ""micro lockdown"" ""molecular lockdown"" ""quark lockdown""  ""universe lockdown""",ro,,1,0,0,https://twitter.com/professordeka/status/1311570833513406465,false,,0,,,,,,,,,,,,,,,,,,,,,,,,,,,,,,,,,,,,,,,,,,,,,,,,,,,,,,,,,,,,,,
1311569962855587800,1311212456018997249,2020-10-01 14:33:41 SE Asia Standard Time,2020-10-01,14:33:41,+0700,486206650,bank_dki,bank_dki,,"@hemohemo_ninja Selamat Siang Bpk/Ibu, mohon maaf atas ketidaknyamanannya. Dapat kami sampaikan selama PSBB transisi pelayanan Bank DKI beroperasional pukul 08.30 - 14.00 WIB.",in,,1,0,0,https://twitter.com/bank_dki/status/1311569962855587840,false,,0,,,,,,,,,,,,hemohemo_ninja,Hemo Hemo,274457901,,,,,,,,,,,,,,,,,,,,,,,,,,,,,,,,,,,,,,,,,,,,,,,,
1311557655459061800,1311554888833220608,2020-10-01 13:44:47 SE Asia Standard Time,2020-10-01,13:44:47,+0700,46693544,chrissdhon,ДОН,,"Contoh nih kerajaan tangerang, dari maret lalu konsisten PSBB. Jakarta masih pake kendor dengan PSBB transisi, tapi tangerang strict PSBB tros. Tapi tempat umum masih penuh, banyak yg keluar ga pake masker, masih ada pasar malem, rapid test juga dikit bgt.",in,,0,0,0,https://twitter.com/chrissdhon/status/1311557655459061760,false,,0,,,,,,,,,,,,,,,,,,,,,,,,,,,,,,,,,,,,,,,,,,,,,,,,,,,,,,,,,,,,,,
1311360282430767000,1311360282430767105,2020-10-01 00:40:29 SE Asia Standard Time,2020-10-01,00:40:29,+0700,2917064060,lenterakris,LenteraKristiani.com,,Pergub Baru Anies: Motor Pribadi Kena Ganjil Genap Saat PSBB Transisi  https://t.co/lK5AKbgE5D,in,https://ahbnews.com/pergub-baru-anies-motor-pribadi-kena-ganjil-genap-saat-psbb-transisi/?utm_source=ReviveOldPost&utm_medium=social&utm_campaign=ReviveOldPost,0,0,0,https://twitter.com/LenteraKris/status/1311360282430767105,false,,0,,,,,,,,,,,,,,,,,,,,,,,,,,,,,,,,,,,,,,,,,,,,,,,,,,,,,,,,,,,,,,
1311318914844876800,1311318914844876800,2020-09-30 21:56:07 SE Asia Standard Time,2020-09-30,21:56:07,+0700,1086650434251411500,richietan13,Richie Tan,, https://t.co/H5fXVYUVOB Dr Tirta membuka dana anggaran covid 19 #psbb #covid19 #corona #jakarta #pemerintah #psbbnewnormal #psbbtotal #sanksisosial #psbbtransisi #pelanggarpsbb #masker #hatihati #pelanggarpsbb #tidakpakaimasker #bersihkankali #aturanpsbbterbaru #sanksipsbb,in,https://youtu.be/bg1ghTpYDzg,0,0,0,https://twitter.com/RichieTan13/status/1311318914844876800,false,,0,,,,,,,,,,,,,,,psbb,covid19,corona,jakarta,pemerintah,psbbnewnormal,psbbtotal,sanksisosial,psbbtransisi,pelanggarpsbb,masker,hatihati,,,,,,,,,,,,,,,,,,,,,,,,,pelanggarpsbb,tidakpakaimasker,bersihkankali,aturanpsbbterbaru,sanksipsbb,,,,,,,
1311313259140542500,1311313259140542465,2020-09-30 21:33:38 SE Asia Standard Time,2020-09-30,21:33:38,+0700,507279528,hariaboo,Hari Junianto,,PSBB PSBM NEW NORMAL PSBB TRANSISI MINI LOCKDOWN MICRO LOCKDOWN NANO LOCKDOWN  TERSERAH!,in,,0,0,0,https://twitter.com/hariaboo/status/1311313259140542465,false,,0,,,,,,,,,,,,,,,,,,,,,,,,,,,,,,,,,,,,,,,,,,,,,,,,,,,,,,,,,,,,,,
1311304836311179300,1311304836311179264,2020-09-30 21:00:10 SE Asia Standard Time,2020-09-30,21:00:10,+0700,168082298,sigitwid,Sigit Widodo,,"PSI mengusulkan pemberian insentif kepada tenaga medis dan tenaga pendukung dengan tepat waktu dan jumlah yang sesuai, dan pemberlakuan PSBB dan PSBB transisi dengan indikator-2 yang jelas dan terukur.  @psi_id @PSI_Jakarta @ASastroamidjojo @aniesbaswedan   https://t.co/hru0oqrAc2",in,https://megapolitan.kompas.com/read/2020/09/30/18285661/psi-dki-jakarta-desak-insentif-nakes-hingga-kewajiban-berkoordinasi-masuk,0,8,26,https://twitter.com/sigitwid/status/1311304836311179264,false,,0,,,,,,,,,,,,,,,,,,,,,,,,,,,psi_id,dpp psi,3102442327,psi_jakarta,psi jakarta | #beranivaksinsehat,4329003615,,,,,,,,,,,,,,,,,,,,,,,,,asastroamidjojo,anggara wicitra sastroamidjojo,1163833191465046016,aniesbaswedan,anies baswedan | sudah #vaksindulu,110312278
1311294440053461000,1311289703203700743,2020-09-30 20:18:51 SE Asia Standard Time,2020-09-30,20:18:51,+0700,1276385451390066700,roocuronnniium,sgegg,,@CNNIndonesia PSBB PSBB TRANSISI MINI LOCKDOWN MICRO LOCKDOWN REGIONAL LOCKDOWN LOCKDOWN BERSKALA BESAR TERBATAS LOCKDOWN BERSKALA BESAR TRANSISI,in,,0,0,3,https://twitter.com/roocuronnniium/status/1311294440053460992,false,,0,,,,,,,,,,,,CNNIndonesia,CNN Indonesia,17128975,,,,,,,,,,,,,,,,,,,,,,,,,,,,,,,,,,,,,,,,,,,,,,,,
1311273119693201400,1311273119693201410,2020-09-30 18:54:08 SE Asia Standard Time,2020-09-30,18:54:08,+0700,1231841640475590700,neliah13306603,Neliah,, https://t.co/ImVN73dBvo  #PenumpangMRT #MRT #PSBB #PSBBTransisi,und,https://satukliknews.com/2020/09/30/psbb-ketat-jakarta-jumlah-penumpang-mrt-menurun/,0,0,0,https://twitter.com/Neliah13306603/status/1311273119693201410,false,,0,,,,,,,,,,,,,,,penumpangmrt,mrt,psbb,psbbtransisi,,,,,,,,,,,,,,,,,,,,,,,,,,,,,,,,,,,,,,,,,,,,
1311234271143575600,1311234271143575553,2020-09-30 16:19:46 SE Asia Standard Time,2020-09-30,16:19:46,+0700,161155241,pute0820,Putri プテ,,"Ini psbb total perasaan ga ada bedanya ky psbb transisi kmrn, jalanan pagi sore rame aja ky biasa~",in,,0,0,0,https://twitter.com/pute0820/status/1311234271143575553,false,,0,,,,,,,,,,,,,,,,,,,,,,,,,,,,,,,,,,,,,,,,,,,,,,,,,,,,,,,,,,,,,,
1311218749664448500,1311218749664448512,2020-09-30 15:18:05 SE Asia Standard Time,2020-09-30,15:18:05,+0700,23343960,kompascom,Kompas.com,,"Direktur Utama PT MRT Jakarta William P Sabandar mengatakan, jumlah penumpang sempat naik saat PSBB transisi di bulan Juli dan Agustus 2020 lalu.  https://t.co/7bsMUnVUew",in,http://dlvr.it/Rhf3Sh,1,0,1,https://twitter.com/kompascom/status/1311218749664448512,false,,0,,,,,,,,,,,,,,,,,,,,,,,,,,,,,,,,,,,,,,,,,,,,,,,,,,,,,,,,,,,,,,
1311189991528095700,1311189991528095744,2020-09-30 13:23:49 SE Asia Standard Time,2020-09-30,13:23:49,+0700,1086650434251411500,richietan13,Richie Tan,, https://t.co/oCb6RIXLVn Part4  Dr TIRTA ; COVID SEBAGAI SARANA CARI PANGGUNG #psbb #covid19 #corona #jakarta #pemerintah #psbbnewnormal #psbbtotal #sanksisosial #psbbtransisi #pelanggarpsbb #masker #pelanggarpsbb #tidakpakaimasker #bersihkankali #aturanpsbbterbaru #sanksipsbb,in,https://youtu.be/QDIm59TcukA,0,0,0,https://twitter.com/RichieTan13/status/1311189991528095744,false,,0,,,,,,,,,,,,,,,psbb,covid19,corona,jakarta,pemerintah,psbbnewnormal,psbbtotal,sanksisosial,psbbtransisi,pelanggarpsbb,masker,pelanggarpsbb,,,,,,,,,,,,,,,,,,,,,,,,,tidakpakaimasker,bersihkankali,aturanpsbbterbaru,sanksipsbb,,,,,,,,
1311138419142275000,1311138419142275075,2020-09-30 09:58:53 SE Asia Standard Time,2020-09-30,09:58:53,+0700,2917064060,lenterakris,LenteraKristiani.com,,Pergub Baru Anies: Motor Pribadi Kena Ganjil Genap Saat PSBB Transisi  https://t.co/lK5AKbgE5D,in,https://ahbnews.com/pergub-baru-anies-motor-pribadi-kena-ganjil-genap-saat-psbb-transisi/?utm_source=ReviveOldPost&utm_medium=social&utm_campaign=ReviveOldPost,0,0,0,https://twitter.com/LenteraKris/status/1311138419142275075,false,,0,,,,,,,,,,,,,,,,,,,,,,,,,,,,,,,,,,,,,,,,,,,,,,,,,,,,,,,,,,,,,,
1311114906955952000,1311114906955952128,2020-09-30 08:25:27 SE Asia Standard Time,2020-09-30,08:25:27,+0700,46278713,maidina__,Maidina Rahmawati,,Dr awal jakarta punya psbb transisi pun karena pempus kan. Efektif? Yaitu 4000 kasus per hari..,in,,0,0,1,https://twitter.com/maidina__/status/1311114906955952128,false,https://twitter.com/TirtoID/status/1311106134590148609,0,,,,,,,,,,,,,,,,,,,,,,,,,,,,,,,,,,,,,,,,,,,,,,,,,,,,,,,,,,,,,,
1311111606525259800,1311111606525259776,2020-09-30 08:12:20 SE Asia Standard Time,2020-09-30,08:12:20,+0700,1974164089,swarakyatcom,SWARAKYAT NEWS,,"Tak Mau Kalah dengan Anies PSBB Transisi, Jokowi Punya Istilah Baru yaitu Mini Lockdown  https://t.co/T0PBny2d94",in,https://www.swarakyat.com/2020/09/tak-mau-kalah-dengan-anies-psbb.html,4,0,3,https://twitter.com/swarakyatcom/status/1311111606525259776,false,,0,,,,,,,,,,,,,,,,,,,,,,,,,,,,,,,,,,,,,,,,,,,,,,,,,,,,,,,,,,,,,,
1311097198319341600,1311097198319341569,2020-09-30 07:15:05 SE Asia Standard Time,2020-09-30,07:15:05,+0700,338442037,edwin_santoso3,Edwin Santoso,,"Daripada memperbanyak terminologi program seperti PSBB total, PSBB transisi, PSBM, Mini Lockdown, dll, mungkin baiknya temen2 kemenkes, satgas/gugus tugas bisa adopt beberapa approach dari taiwan. 6 Months Covid: Jumlah kasus &lt;700 dan kematian &lt;50..  https://t.co/nZT31qQc7t",in,https://www.cnbc.com/2020/07/15/how-taiwan-beat-the-coronavirus.html,0,0,0,https://twitter.com/edwin_santoso3/status/1311097198319341569,false,,0,,,,,,,,,,,,,,,,,,,,,,,,,,,,,,,,,,,,,,,,,,,,,,,,,,,,,,,,,,,,,,
1311084271537275000,1311084271537274882,2020-09-30 06:23:43 SE Asia Standard Time,2020-09-30,06:23:43,+0700,1086650434251411500,richietan13,Richie Tan,, https://t.co/qn1mGBCTKO DR. TIRTA ; VAKSIN BUKAN OBAT #psbb #covid19 #corona #jakarta #pemerintah #psbbnewnormal #psbbtotal #sanksisosial #psbbtransisi #pelanggarpsbb #masker #hatihati #pelanggarpsbb #tidakpakaimasker #bersihkankali #aturanpsbbterbaru #sanksipsbb,in,https://youtu.be/wVSe9nPxS6A,0,0,0,https://twitter.com/RichieTan13/status/1311084271537274882,false,,0,,,,,,,,,,,,,,,psbb,covid19,corona,jakarta,pemerintah,psbbnewnormal,psbbtotal,sanksisosial,psbbtransisi,pelanggarpsbb,masker,hatihati,,,,,,,,,,,,,,,,,,,,,,,,,pelanggarpsbb,tidakpakaimasker,bersihkankali,aturanpsbbterbaru,sanksipsbb,,,,,,,
